{
  "schemaVersion": 1,
  "toneId": "chalkboard",
  "toneRevision": "rollout-1",
  "collectionVersion": "0.1.0",
  "coordinateSystem": {
    "viewBox": [0, 0, 720, 400],
    "units": "svg-user-units"
  },
  "geometry": {
    "strokeWidths": {
      "outline": 2.8,
      "connector": 2.7,
      "detail": 0.8
    },
    "radii": {
      "card": 0,
      "head": 14
    },
    "fills": {
      "body": "surface",
      "focus": "accent",
      "subordinate": "deep"
    },
    "opacities": {
      "solid": 1,
      "wash": 0.32,
      "secondary": 0.55,
      "grain": 0.22
    },
    "layers": {
      "offset": {
        "dx": 7,
        "dy": 6,
        "opacity": 0.7
      }
    }
  },
  "palette": {
    "light": {
      "ink": "#F0EEE0",
      "surface": "#203B34",
      "border": "#415E51",
      "accent": "#E9C774",
      "deep": "#ABBAAC",
      "warning": "#E9C774"
    },
    "dark": {
      "ink": "#F5F2E3",
      "surface": "#13231F",
      "border": "#2A4135",
      "accent": "#F0D189",
      "deep": "#9EACA0",
      "warning": "#F0D189"
    }
  },
  "typography": {
    "label": {
      "fontFamily": "'Noto Sans CJK JP', sans-serif",
      "fontSize": 22,
      "minCssPx": 18,
      "fontWeight": 600
    },
    "detail": {
      "fontFamily": "'Noto Sans CJK JP', sans-serif",
      "fontSize": 18,
      "minCssPx": 16,
      "fontWeight": 400
    },
    "specimen": {
      "fontFamily": "'Noto Sans CJK JP', sans-serif",
      "fontSize": 56,
      "minCssPx": 24,
      "fontWeight": 700
    }
  },
  "texture": {
    "kind": "broken-chalk-and-dust",
    "seed": 0,
    "amplitude": 0,
    "frequency": 79
  },
  "composition": {
    "arrows": "Broken chalk contours with a faint second pass, sparse dust, warm accents and open blackboard ground. Direction has one explicit terminal head.",
    "people": "Broken chalk contours with a faint second pass, sparse dust, warm accents and open blackboard ground. One head and one body identify one participant; decorative backing is not another person.",
    "empty": "Broken chalk contours with a faint second pass, sparse dust, warm accents and open blackboard ground. Chair back, seat and legs remain visibly unoccupied; label vacancy explicitly.",
    "pending": "Broken chalk contours with a faint second pass, sparse dust, warm accents and open blackboard ground. A clock mark accompanies an explicit pending label; not a completion check.",
    "emphasis": "Broken chalk contours with a faint second pass, sparse dust, warm accents and open blackboard ground. Essential labels retain a clean surface and opaque ink.",
    "warning": "Broken chalk contours with a faint second pass, sparse dust, warm accents and open blackboard ground. Warning role is paired with explicit wording, not color alone."
  },
  "rules": {
    "required": [
      {
        "id": "native-construction",
        "description": "Broken chalk contours with a faint second pass, sparse dust, warm accents and open blackboard ground."
      },
      {
        "id": "facts",
        "description": "Retain exact labels, factual object counts and locked relations; vacancy, pending and complete are different states."
      },
      {
        "id": "palette",
        "description": "Use all six resolved semantic roles without changing geometry; restricted print tones may map roles to the same spot ink."
      },
      {
        "id": "label-readability",
        "description": "Keep essential Japanese text upright, outside dense texture or projected planes, and inspect at the actual placement."
      }
    ],
    "preferred": [
      {
        "id": "reference-transfer",
        "description": "Derive principal object construction from source.svg and its explicit light/dark exports, not one reusable generic icon family."
      },
      {
        "id": "quiet-labels",
        "description": "Keep decorative texture and overlaps in picture regions; leave the label reading route clear."
      }
    ],
    "flexible": [
      {
        "id": "layout",
        "description": "Object positions, line breaks, motif count and routing adapt to the brief and target."
      },
      {
        "id": "small-detail",
        "description": "Both palettes retain an intrinsic dark ground; dashed chalk marks can vanish when downscaled."
      }
    ]
  }
}
