{
  "schemaVersion": 1,
  "toneId": "halftone-manual",
  "toneRevision": "rollout-1",
  "collectionVersion": "0.1.0",
  "coordinateSystem": {
    "viewBox": [0, 0, 720, 400],
    "units": "svg-user-units"
  },
  "geometry": {
    "strokeWidths": {
      "outline": 3,
      "connector": 3,
      "detail": 1.5
    },
    "radii": {
      "card": 0,
      "head": 14
    },
    "fills": {
      "body": "surface",
      "focus": "accent",
      "subordinate": "deep"
    },
    "opacities": {
      "solid": 1,
      "wash": 0.32,
      "secondary": 0.55,
      "grain": 0.22
    },
    "layers": {
      "offset": {
        "dx": 7,
        "dy": 6,
        "opacity": 0.7
      }
    }
  },
  "palette": {
    "light": {
      "ink": "#25282A",
      "surface": "#F8F7F2",
      "border": "#DEDDD4",
      "accent": "#25282A",
      "deep": "#25282A",
      "warning": "#25282A"
    },
    "dark": {
      "ink": "#F4F1E5",
      "surface": "#202326",
      "border": "#44494B",
      "accent": "#F4F1E5",
      "deep": "#F4F1E5",
      "warning": "#F4F1E5"
    }
  },
  "typography": {
    "label": {
      "fontFamily": "'Noto Sans CJK JP', sans-serif",
      "fontSize": 22,
      "minCssPx": 18,
      "fontWeight": 600
    },
    "detail": {
      "fontFamily": "'Noto Sans CJK JP', sans-serif",
      "fontSize": 18,
      "minCssPx": 16,
      "fontWeight": 400
    },
    "specimen": {
      "fontFamily": "'Noto Sans CJK JP', sans-serif",
      "fontSize": 56,
      "minCssPx": 24,
      "fontWeight": 700
    }
  },
  "texture": {
    "kind": "dot-screen-and-hatch",
    "seed": 0,
    "amplitude": 0,
    "frequency": 8
  },
  "composition": {
    "arrows": "Firm monochrome keylines, picture-area dot screens and diagonal hatching; essential labels occupy clean knockout ground. Direction has one explicit terminal head.",
    "people": "Firm monochrome keylines, picture-area dot screens and diagonal hatching; essential labels occupy clean knockout ground. One head and one body identify one participant; decorative backing is not another person.",
    "empty": "Firm monochrome keylines, picture-area dot screens and diagonal hatching; essential labels occupy clean knockout ground. Chair back, seat and legs remain visibly unoccupied; label vacancy explicitly.",
    "pending": "Firm monochrome keylines, picture-area dot screens and diagonal hatching; essential labels occupy clean knockout ground. A clock mark accompanies an explicit pending label; not a completion check.",
    "emphasis": "Firm monochrome keylines, picture-area dot screens and diagonal hatching; essential labels occupy clean knockout ground. Essential labels retain a clean surface and opaque ink.",
    "warning": "Firm monochrome keylines, picture-area dot screens and diagonal hatching; essential labels occupy clean knockout ground. Warning role is paired with explicit wording, not color alone."
  },
  "rules": {
    "required": [
      {
        "id": "native-construction",
        "description": "Firm monochrome keylines, picture-area dot screens and diagonal hatching; essential labels occupy clean knockout ground."
      },
      {
        "id": "facts",
        "description": "Retain exact labels, factual object counts and locked relations; vacancy, pending and complete are different states."
      },
      {
        "id": "palette",
        "description": "Use all six resolved semantic roles without changing geometry; restricted print tones may map roles to the same spot ink."
      },
      {
        "id": "label-readability",
        "description": "Keep essential Japanese text upright, outside dense texture or projected planes, and inspect at the actual placement."
      }
    ],
    "preferred": [
      {
        "id": "reference-transfer",
        "description": "Derive principal object construction from source.svg and its explicit light/dark exports, not one reusable generic icon family."
      },
      {
        "id": "quiet-labels",
        "description": "Keep decorative texture and overlaps in picture regions; leave the label reading route clear."
      }
    ],
    "flexible": [
      {
        "id": "layout",
        "description": "Object positions, line breaks, motif count and routing adapt to the brief and target."
      },
      {
        "id": "small-detail",
        "description": "Dot screens may alias at reduced size; screen spacing must be judged in the actual raster capture."
      }
    ]
  }
}
